X1;tahun;judul;keterangan;urls;topik_no;topik;abstrak
24;2016;Pointing the Unknown Words;TLDR: Proposes a copy-mechanism for allowing MT systems to more effectively copy words from a source context sequence.;https://www.aclweb.org/anthology/P16-1014;7; Machine Translation;Hidden Markov models (HMMs) are a powerful probabilistic tool for modeling sequential data, and have been applied with success to many text-related tasks, such as part-of-speech tagging, text segmentation and information extraction. In these cases, the observations are usually mod- eled as multinomial distributions over a discrete vocabulary, and the HMM parameters are set to maximize the likelihood of the observations. This paper presents a new Markovian sequence model, closely related to HMMs, that allows ob- servations to be represented as arbitrary overlap- ping features (such as word, capitalization, for- matting, part-of-speech), and defines the condi- tional probability of state sequences given ob- servation sequences. It does this by using the maximum entropy framework to fit a set of expo- nential models that represent the probability of a state given an observation and the previous state. We present positive experimental results on the segmentation of FAQ’s 
25;2016;Google's Neural Machine Translation System: Bridging the Gap between Human and Machine Translation;TLDR: A wonderful case-study demonstrating what a production-capacity machine translation system (in this case that of Google) looks like.;https://arxiv.org/pdf/1609.08144.pdf;7; Machine Translation;Neural Machine Translation (NMT) is an end-to-end learning approach for automated translation, with the potential to overcome many of the weaknesses of conventional phrase-based translation systems. Unfortunately, NMT systems are known to be computationally expensive both in training and in translation inference – sometimes prohibitively so in the case of very large data sets and large models. Several authors have also charged that NMT systems lack robustness, particularly when input sentences contain rare words. These issues have hindered NMT’s use in practical deployments and services, where both accuracy and speed are essential. In this work, we present GNMT, Google’s Neural Machine Translation system, which attempts to address many of these issues. Our model consists of a deep LSTM network with 8 encoder and 8 decoder layers using residual connections as well as attention connections from the decoder network to the encoder. To improve parallelism and therefore decrease training time, our attention mechanism connects the bottom layer of the decoder to the top layer of the encoder. To accelerate the final translation speed, we employ low-precision arithmetic during inference computations. To improve handling of rare words, we divide words into a limited set of common sub-word units (“wordpieces”) for both input and output. This method provides a good balance between the flexibility of “character”-delimited models and the efficiency of “word”-delimited models, naturally handles translation of rare words, and ultimately improves the overall accuracy of the system. Our beam search technique employs a length-normalization procedure and uses a coverage penalty, which encourages generation of an output sentence that is most likely to cover all the words in the source sentence. To directly optimize the translation BLEU scores, we consider refining the models by using reinforcement learning, but we found that the improvement in the BLEU scores did not reflect in the human evaluation. On the WMT’14 English-to-French and English-to-German benchmarks, GNMT achieves competitive results to state-of-the-art. Using a human side-by-side evaluation on a set of isolated simple sentences, it reduces translation errors by an average of 60% compared to Google’s phrase-based production system. 
27;2014;Semantic Parsing via Paraphrasing;TLDR: Develops a unique paraphrase model for learning appropriate candidate logical forms from question-answer pairs, improving SOTA on existing Q/A datasets.;http://aclweb.org/anthology/P14-1133;7; Machine Translation;A central challenge in semantic parsing is handling the myriad ways in which knowl- edge base predicates can be expressed. Traditionally, semantic parsers are trained primarily from text paired with knowledge base information. Our goal is to exploit the much larger amounts of raw text not tied to any knowledge base. In this pa- per, we turn semantic parsing on its head. Given an input utterance, we first use a simple method to deterministically gener- ate a set of candidate logical forms with a canonical realization in natural language for each. Then, we use a paraphrase model to choose the realization that best para- phrases the input, and output the corre- sponding logical form. We present two simple paraphrase models, an association model and a vector space model, and train them jointly from question-answer pairs. Our system PARASEMPRE improves state- of-the-art accuracies on two recently re- leased question-answering datasets. 
28;2015;Building a Semantic Parser Overnight;TLDR: Neat paper showing that a semantic parser can be built from scratch starting with no training examples!;https://cs.stanford.edu/~pliang/papers/overnight-acl2015.pdf;7; Machine Translation;How do we build a semantic parser in a new domain starting with zero training ex- amples? We introduce a new methodol- ogy for this setting: First, we use a simple grammar to generate logical forms paired with canonical utterances. The logical forms are meant to cover the desired set of compositional operators, and the canon- ical utterances are meant to capture the meaning of the logical forms (although clumsily). We then use crowdsourcing to paraphrase these canonical utterances into natural utterances. The resulting data is used to train the semantic parser. We fur- ther study the role of compositionality in the resulting paraphrases. Finally, we test our methodology on seven domains and show that we can build an adequate se- mantic parser in just a few hours. 
29;2015;Bringing Machine Learning and Computational Semantics Together;TLDR: A nice overview of a computational semantics framework that uses machine learning to effectively learn logical forms for semantic parsing.;http://www.stanford.edu/~cgpotts/manuscripts/liang-potts-semantics.pdf;8; Semantic Parsing;"Variants of Naive Bayes (NB) and Support Vector Machines (SVM) are often used as baseline methods for text classification, but their performance varies greatly depending on the model variant, features used and task/ dataset. We show that: (i) the inclusion of word bigram features gives consistent gains on sentiment analysis tasks; (ii) for short snippet sentiment tasks, NB actually does better than SVMs (while for longer documents the oppo- site result holds); (iii) a simple but novel SVM variant using NB log-count ratios as feature values consistently performs well across tasks and datasets. Based on these observations, we identify simple NB and SVM variants which outperform most published results on senti- ment analysis datasets, sometimes providing a new state-of-the-art performance level. "
30;2016;A Thorough Examination of the CNN/Daily Mail Reading Comprehension Task;TLDR: A great wake-up call paper, demonstrating that SOTA performance can be achieved on certain reading comprehension datasets using simple systems with carefully chosen features. Don't forget non-deep learning methods!;https://arxiv.org/pdf/1606.02858.pdf;8; Semantic Parsing;Enabling a computer to understand a document so that it can answer comprehension questions is a central, yet unsolved goal of NLP. A key factor impeding its solution by machine learned systems is the limited availability of human-annotated data. Hermann et al. (2015) seek to solve this problem by creating over a million training examples by pairing CNN and Daily Mail news articles with their summarized bullet points, and show that a neural network can then be trained to give good performance on this task. In this paper, we conduct a thorough examination of this new reading comprehension task. Our primary aim is to understand what depth of language understanding is required to do well on this task. We approach this from one side by doing a careful hand-analysis of a small subset of the problems and from the other by showing that simple, carefully designed systems can obtain accuracies of 73.6% and 76.6% on these two datasets, exceeding current state-of-the-art results by 7–10% and approaching what we believe is the ceiling for performance on this task
31;2017;SQuAD: 100,000+ Questions for Machine Comprehension of Text;TLDR: Introduces the SQUAD dataset, a question-answering corpus that has become one of the defacto benchmarks used today.;https://arxiv.org/pdf/1606.05250.pdf;8; Semantic Parsing;We present the Stanford Question Answer- ing Dataset (SQuAD), a new reading compre- hension dataset consisting of 100,000+ ques- tions posed by crowdworkers on a set of Wikipedia articles, where the answer to each question is a segment of text from the cor- responding reading passage. We analyze the dataset to understand the types of reason- ing required to answer the questions, lean- ing heavily on dependency and constituency trees. We build a strong logistic regression model, which achieves an F1 score of 51.0%, a significant improvement over a simple base- line (20%). However, human performance (86.8%) is much higher, indicating that the dataset presents a good challenge problem for future research. The dataset is freely available at https://stanford-qa.com. 
32;2004;ROUGE: A Package for Automatic Evaluation of Summaries;TLDR: Introduces ROUGE, an evaluation metric for summarization that is used to this day on a variety of sequence transduction tasks.;https://www.aclweb.org/anthology/W04-1013;8; Semantic Parsing;ROUGE stands for Recall-Oriented Understudy for Gisting Evaluation. It includes measures to auto- matically determine the quality of a summary by comparing it to other (ideal) summaries created by humans. The measures count the number of over- lapping units such as n-gram, word sequences, and word pairs between the computer-generated sum- mary to be evaluated and the ideal summaries cre- ated by humans. This paper introduces four different ROUGE measures: ROUGE-N, ROUGE-L, ROUGE-W, and ROUGE-S included in the ROUGE summariza- tion evaluation package and their evaluatio ns. Three of them have been used in the Document Under- standing Conference (DUC) 2004, a large -scale summarization evaluation sponsored by NIST. 
33;2015;Semantically Conditioned LSTM-based Natural Language Generation for Spoken Dialogue Systems;TLDR: Proposes a neural natural language generator that jointly optimises sentence planning and surface realization, outperforming other systems on human eval.;https://arxiv.org/pdf/1508.01745.pdf;9; Question Answering/Reading Comprehension;Natural language generation (NLG) is a critical component of spoken dialogue and it has a significant impact both on usabil- ity and perceived quality. Most NLG sys- tems in common use employ rules and heuristics and tend to generate rigid and stylised responses without the natural vari- ation of human language. They are also not easily scaled to systems covering mul- tiple domains and languages. This pa- per presents a statistical language gener- ator based on a semantically controlled Long Short-term Memory (LSTM) struc- ture. The LSTM generator can learn from unaligned data by jointly optimising sen- tence planning and surface realisation us- ing a simple cross entropy training crite- rion, and language variation can be eas- ily achieved by sampling from output can- didates. With fewer heuristics, an objec- tive evaluation in two differing test do- mains showed the proposed method im- proved performance compared to previ- ous methods. Human judges scored the LSTM system higher on informativeness and naturalness and overall preferred it to the other systems. 
34;2016;Pointing the Unknown Words;TLDR: Proposes a copy-mechanism for allowing MT systems to more effectively copy words from a source context sequence.;https://arxiv.org/pdf/1603.08148.pdf;9; Question Answering/Reading Comprehension;ROUGE stands for Recall-Oriented Understudy for Gisting Evaluation. It includes measures to auto- matically determine the quality of a summary by comparing it to other (ideal) summaries created by humans. The measures count the number of over- lapping units such as n-gram, word sequences, and word pairs between the computer-generated sum- mary to be evaluated and the ideal summaries cre- ated by humans. This paper introduces four different ROUGE measures: ROUGE-N, ROUGE-L, ROUGE-W, and ROUGE-S included in the ROUGE summariza- tion evaluation package and their evaluatio ns. Three of them have been used in the Document Under- standing Conference (DUC) 2004, a large -scale summarization evaluation sponsored by NIST. 
35;2017;Get To The Point: Summarization with Pointer-Generator Networks;TLDR: This work offers an elegant soft copy mechanism, that drastically outperforms the SOTA on abstractive summarization.;https://arxiv.org/pdf/1704.04368.pdf;10; Natural Language Generation/Summarization;Neural sequence-to-sequence models have provided a viable new approach for ab- stractive text summarization (meaning they are not restricted to simply selecting and rearranging passages from the origi- nal text). However, these models have two shortcomings: they are liable to reproduce factual details inaccurately, and they tend to repeat themselves. In this work we pro- pose a novel architecture that augments the standard sequence-to-sequence attentional model in two orthogonal ways. First, we use a hybrid pointer-generator network that can copy words from the source text via pointing, which aids accurate repro- duction of information, while retaining the ability to produce novel words through the generator. Second, we use coverage to keep track of what has been summarized, which discourages repetition. We apply our model to the CNN / Daily Mail sum- marization task, outperforming the current abstractive state-of-the-art by at least 2 ROUGE points. 
36;2011;Data-drive Response Generation in Social Media;TLDR: Proposes using phrase-based statistical machine translation methods to the problem of response generation.;http://dl.acm.org/citation.cfm?id=2145500;10; Natural Language Generation/Summarization;Human evaluations of machine translation are extensive but expensive. Human eval- uations can take months to finish and in- volve human labor that can not be reused. We propose a method of automatic ma- chine translation evaluation that is quick, inexpensive, and language-independent, that correlates highly with human evalu- ation, and that has little marginal cost per run. We present this method as an auto- mated understudy to skilled human judges which substitutes for them when there is need for quick or frequent evaluations 
37;2015;Semantically Conditioned LSTM-based Natural Language Generation for Spoken Dialogue Systems;TLDR: Proposes a neural natural language generator that jointly optimises sentence planning and surface realization, outperforming other systems on human eval.;https://arxiv.org/pdf/1508.01745.pdf;10; Natural Language Generation/Summarization;Natural language generation (NLG) is a critical component of spoken dialogue and it has a significant impact both on usabil- ity and perceived quality. Most NLG sys- tems in common use employ rules and heuristics and tend to generate rigid and stylised responses without the natural vari- ation of human language. They are also not easily scaled to systems covering mul- tiple domains and languages. This pa- per presents a statistical language gener- ator based on a semantically controlled Long Short-term Memory (LSTM) struc- ture. The LSTM generator can learn from unaligned data by jointly optimising sen- tence planning and surface realisation us- ing a simple cross entropy training crite- rion, and language variation can be eas- ily achieved by sampling from output can- didates. With fewer heuristics, an objec- tive evaluation in two differing test do- mains showed the proposed method im- proved performance compared to previ- ous methods. Human judges scored the LSTM system higher on informativeness and naturalness and overall preferred it to the other systems. 
38;2016;How NOT To Evaluate Your Dialogue System: An Empirical Study of Unsupervised Evaluation Metrics for Dialogue Response Generation;TLDR: Important work demonstrating that existing automatic metrics used for dialogue woefully do not correlate well with human judgment.;https://arxiv.org/pdf/1603.08023.pdf;10; Natural Language Generation/Summarization;We investigate evaluation metrics for dialogue response generation systems where supervised labels, such as task completion, are not avail- able. Recent works in response generation have adopted metrics from machine transla- tion to compare a model’s generated response to a single target response. We show that these metrics correlate very weakly with hu- man judgements in the non-technical Twitter domain, and not at all in the technical Ubuntu domain. We provide quantitative and quali- tative results highlighting specific weaknesses in existing metrics, and provide recommenda- tions for future development of better auto- matic evaluation metrics for dialogue systems. 
39;2016;A Network-based End-to-End Trainable Task-oriented Dialogue System;TLDR: Proposes a neat architecture for decomposing a dialogue system into a number of individually-trained neural network components.;https://arxiv.org/pdf/1604.04562.pdf;11; Dialogue Systems;Teaching machines to accomplish tasks by conversing naturally with humans is challenging. Currently, developing task- oriented dialogue systems requires creating multiple components and typically this in- volves either a large amount of handcraft- ing, or acquiring costly labelled datasets to solve a statistical learning problem for each component. In this work we intro- duce a neural network-based text-in, text- out end-to-end trainable goal-oriented di- alogue system along with a new way of collecting dialogue data based on a novel pipe-lined Wizard-of-Oz framework. This approach allows us to develop dialogue sys- tems easily and without making too many assumptions about the task at hand. The results show that the model can converse with human subjects naturally whilst help- ing them to accomplish tasks in a restaurant search domain. 
40;2016;A Diversity-Promoting Objective Function for Neural Conversation Models;TLDR: Introduces a maximum mutual information objective function for training dialogue systems.;https://arxiv.org/pdf/1510.03055.pdf;11; Dialogue Systems;Sequence-to-sequence neural network mod- els for generation of conversational responses tend to generate safe, commonplace responses (e.g., I don’t know) regardless of the input. We suggest that the traditional objective func- tion, i.e., the likelihood of output (response) given input (message) is unsuited to response generation tasks. Instead we propose using Maximum Mutual Information (MMI) as the objective function in neural models. Experi- mental results demonstrate that the proposed MMI models produce more diverse, interest- ing, and appropriate responses, yielding sub- stantive gains in BLEU scores on two conver- sational datasets and in human evaluations. 
41;2016;The Dialogue State Tracking Challenge Series: A Review;TLDR: A nice overview of the dialogue state tracking challenges for dialogue systems.;https://pdfs.semanticscholar.org/4ba3/39bd571585fadb1fb1d14ef902b6784f574f.pdf;11; Dialogue Systems;"In a spoken dialog system, dialog state tracking refers to the task of correctly inferring the state of the conversation – such as the user’s goal – given all of the dialog history up to that turn. Dialog state tracking is crucial to the success of a dialog system, yet until recently there were no common resources, hampering progress. The Dialog State Tracking Challenge series of 3 tasks introduced the first shared testbed and evaluation metrics for dialog state tracking, and has underpinned three key advances in dialog state tracking: the move from generative to discriminative models; the adoption of discriminative sequential techniques; and the incorporation of the speech recognition results directly into the dialog state tracker. This paper reviews this research area, covering both the challenge tasks themselves and summarizing the work they have enabled."
42;2017;A Copy-Augmented Sequence-to-Sequence Architecture Gives Good Performance on Task-Oriented Dialogue;TLDR: Shows that simple sequence-to-sequence architectures with a copy mechanism can perform competitively on existing task-oriented dialogue datasets.;https://arxiv.org/pdf/1701.04024.pdf;11; Dialogue Systems;Task-oriented dialogue focuses on con- versational agents that participate in dia- logues with user goals on domain-specific topics. In contrast to chatbots, which sim- ply seek to sustain open-ended meaning- ful discourse, existing task-oriented agents usually explicitly model user intent and belief states. This paper examines bypass- ing such an explicit representation by de- pending on a latent neural embedding of state and learning selective attention to di- alogue history together with copying to in- corporate relevant prior context. We com- plement recent work by showing the effec- tiveness of simple sequence-to-sequence neural architectures with a copy mecha- nism. Our model outperforms more com- plex memory-augmented models by 7% in per-response generation and is on par with the current state-of-the-art on DSTC2, a real-world task-oriented dialogue dataset 
43;2017;Key-Value Retrieval Networks for Task-Oriented Dialogue;TLDR: Introduces a new multidomain dataset for task-oriented dataset as well as an architecture for softly incorporating information from structured knowledge bases into dialogue systems.;https://arxiv.org/pdf/1705.05414.pdf;11; Dialogue Systems;Neural task-oriented dialogue systems of- ten struggle to smoothly interface with a knowledge base. In this work, we seek to address this problem by proposing a new neural dialogue agent that is able to effec- tively sustain grounded, multi-domain dis- course through a novel key-value retrieval mechanism. The model is end-to-end dif- ferentiable and does not need to explicitly model dialogue state or belief trackers. We also release a new dataset of 3,031 dia- logues that are grounded through underly- ing knowledge bases and span three dis- tinct tasks in the in-car personal assistant space: calendar scheduling, weather infor- mation retrieval, and point-of-interest nav- igation. Our architecture is simultaneously trained on data from all domains and sig- nificantly outperforms a competitive rule- based system and other existing neural di- alogue architectures on the provided do- mains according to both automatic and hu- man evaluation metrics. 
44;2017;Learning Symmetric Collaborative Dialogue Agents with Dynamic Knowledge Graph Embeddings;TLDR: Introduces a new collaborative dialogue dataset, as well as an architecture for representing structured knowledge via knowledge graph embeddings.;https://arxiv.org/pdf/1704.07130.pdf;11; Dialogue Systems;We study a symmetric collaborative dia- logue setting in which two agents, each with private knowledge, must strategically communicate to achieve a common goal. The open-ended dialogue state in this set- ting poses new challenges for existing di- alogue systems. We collected a dataset of 11K human-human dialogues, which exhibits interesting lexical, semantic, and strategic elements. To model both struc- tured knowledge and unstructured lan- guage, we propose a neural model with dy- namic knowledge graph embeddings that evolve as the dialogue progresses. Au- tomatic and human evaluations show that our model is both more effective at achiev- ing the goal and more human-like than baseline neural and rule-based models. 
45;2017;Hybrid Code Networks: practical and efficient end-to-end dialog control with supervised and reinforcement learning;TLDR: Introduces a hybrid dialogue architecture that can be jointly trained via supervised learning as well as reinforcement learning and combines neural network techniques with fine-grained rule-based approaches.;https://arxiv.org/pdf/1702.03274.pdf;11; Dialogue Systems;"End-to-end learning of recurrent neural networks (RNNs) is an attractive solu- tion for dialog systems; however, cur- rent techniques are data-intensive and re- quire thousands of dialogs to learn sim- ple behaviors. We introduce Hybrid Code Networks (HCNs), which combine an RNN with domain-specific knowledge encoded as software and system action templates. Compared to existing end-to- end approaches, HCNs considerably re- duce the amount of training data required, while retaining the key benefit of inferring a latent representation of dialog state. In addition, HCNs can be optimized with su- pervised learning, reinforcement learning, or a mixture of both. HCNs attain state- of-the-art performance on the bAbI dialog dataset (Bordes and Weston, 2016), and outperform two commercially deployed customer-facing dialog systems. "
46;1971;Procedures as a Representation for Data in a Computer Program for Understanding Natural Language;TLDR: One of the seminal papers in computer science, introducing SHRDLU an early system for computers understanding human language commands.;http://hci.stanford.edu/~winograd/shrdlu/AITR-235.pdf;11; Dialogue Systems;
